Issue Name,Issue Type,Issue Priority,URLs,% of Total,Description,How To Fix,Help URL
H2: Multiple,Warning,Low,8,72.73,"Pages which have multiple <h2>s. This is not an issue as HTML standards allow multiple <h2>'s when used in a logical hierarchical heading structure. However, this filter can help you quickly scan to review if they are used appropriately.","Ensure <h2>s are used in a logical hierarchical heading structure, and update where appropriate utilising the full heading rank between (h3 - h6) for additional headings.",
Content: Low Content Pages,Opportunity,Medium,2,18.18,"Pages with a word count that is below the default 200 words. The word count is based upon the content area settings used in the analysis which can be configured via 'Config > Content > Area'. There isn't a minimum word count for pages in reality, but the search engines do require descriptive text to understand the purpose of a page. This filter should only be used as a rough guide to help identify pages that might be improved by adding more descriptive content in the context of the website and page's purpose. Some websites, such as ecommerce, will naturally have lower word counts, which can be acceptable if a products details can be communicated efficiently.",Consider including additional descriptive content to help the user and search engines better understand the page.,
H2: Missing,Warning,Low,1,9.09,"Pages which have a missing <h2>, the content is empty or has a whitespace. The <h2> heading is often used to describe sections or topics within a document. They act as signposts for the user, and can help search engines understand the page.",Consider using logical and descriptive <h2>s on important pages that help the user and search engines better understand the page.,
Page Titles: Below 30 Characters,Opportunity,Medium,6,54.55,"Pages which have page titles under the configured limit. This isn't necessarily an issue, but it does indicate there might be room to target additional keywords or communicate your USPs.",Consider updating the page title to take advantage of the space left to include additional target keywords or USPs.,
Content: Readability Difficult,Opportunity,Low,6,54.55,Copy on the page is difficult to read and best understood by college graduates according to the Flesch reading-ease score formula. Copy that has long sentences and uses complex words are generally harder to read and understand.,Consider improving the readability of copy for your target audience. Copy that uses shorter sentences with less complex words is often easier to read and understand.,
Response Codes: Internal Blocked by Robots.txt,Warning,High,3,18.75,Internal URLs blocked by the site's robots.txt. This means they cannot be crawled and is a critical issue if you want the page content to be crawled and indexed by search engines. View URLs that link to URLs blocked by robots.txt using the lower 'inlinks' tab and export them in bulk via 'Bulk Export > Response Codes > Internal > Blocked by Robots.txt inlinks'.,"Review URLs to ensure they should be disallowed. If they are incorrectly disallowed, then the site's robots.txt should be updated to allow them to be crawled. Consider whether you should be linking internally to these URLs and remove links where appropriate.",
Page Titles: Below 200 Pixels,Opportunity,Medium,1,9.09,"Pages which have page titles much shorter than Google's estimated pixel length limit. This isn't necessarily an issue, but it does indicate there might be room to target additional keywords or communicate your USPs.",Consider updating the page title to take advantage of the space left to include additional target keywords or USPs.,
H2: Non-Sequential,Warning,Low,1,9.09,"Pages with an <h2> that is not the second heading level after the <h1> on the page. Heading elements should be in a logical sequentially-descending order. The purpose of heading elements is to convey the structure of the page and they should be in logical order from <h1> to <h6>, which helps navigating the page and users that rely on assistive technologies.","Ensure the <h2> is the second heading on the page. Headings should be in a logical sequential order from <h1> to <h6>. Review and update page heading levels so they are descending in order, for example the heading element following an <h1> should be an <h2>, rather than an <h3>.",
